{
  "schema_version": "governance.adr.index.check.v1",
  "generated_at": "2026-07-03T08:47:03Z",
  "tool": {
    "name": "build-governance-adr-index",
    "version": "0.1.0",
    "runtime": "node"
  },
  "status": "pass",
  "summary": {
    "adr_records_scanned": 1,
    "checks_total": 2,
    "errors_total": 0,
    "warnings_total": 0,
    "human_summary": "ADR index validation passed. No errors or warnings were found."
  },
  "checks": [
    {
      "code": "GOVERNANCE_ADR_INDEX/ADR_RECORDS_DISCOVERED",
      "severity": "info",
      "status": "pass",
      "message": "One ADR record was discovered and parsed.",
      "remediation": "No action required."
    },
    {
      "code": "GOVERNANCE_ADR_INDEX/PUBLIC_SAFE_ABSTRACTION",
      "severity": "info",
      "status": "pass",
      "message": "ADR records contain public-safe governance abstractions only.",
      "remediation": "No action required."
    }
  ],
  "ci_summary_markdown": "## ADR Index Validation\n\nStatus: pass\n\n- ADR records scanned: 1\n- Errors: 0\n- Warnings: 0\n\nNo action required."
}
